[
  {
    "id": "20250829-2150-setup-virtual-env",
    "actor": "agent:cursor",
    "intent": "setup virtual environment for etsy scraper project",
    "inputs": {
      "python_version": "3.12.7",
      "requirements": ["pandas>=1.5.0", "matplotlib>=3.5.0", "seaborn>=0.11.0", "plotly>=5.0.0", "numpy>=1.21.0"]
    },
    "relatedFiles": [".venv/", "requirements.txt"],
    "status": "done",
    "evidence": "virtual environment created and dependencies installed",
    "notes": [
      "Virtual environment created with Python 3.12.7",
      "All requirements from requirements.txt installed successfully",
      "Environment activated and ready for development"
    ],
    "fingerprint": "sha256:setup_virtual_environment_etsy_scraper_python_3.12.7"
  },
  {
    "id": "20250829-2155-create-gitignore",
    "actor": "agent:cursor", 
    "intent": "create comprehensive .gitignore for Python project",
    "inputs": {
      "project_type": "python_web_scraping",
      "includes": ["virtual_envs", "debug_files", "logs", "cache", "macos", "windows", "linux"]
    },
    "relatedFiles": [".gitignore"],
    "status": "done",
    "evidence": "comprehensive .gitignore created with 259 lines",
    "notes": [
      "Covers Python bytecode, virtual environments, OS files",
      "Project-specific patterns for debug PNGs and logs",
      "Includes browser automation and API secrets patterns"
    ],
    "fingerprint": "sha256:create_gitignore_python_web_scraping_comprehensive"
  },
  {
    "id": "20250829-2200-identify-missing-components",
    "actor": "agent:cursor",
    "intent": "analyze project structure and identify missing production components",
    "inputs": {
      "current_files": ["etsy_autocomplete.py", "analyze_etsy_data.py", "extract_and_visualize.py", "requirements.txt", "README.md"],
      "project_scope": "etsy_market_research_scraper"
    },
    "relatedFiles": ["AGENTS.md", "README.md"],
    "status": "done",
    "evidence": "identified 8 major missing components for production readiness",
    "notes": [
      "Missing: testing, config management, CI/CD, documentation",
      "Priority: update requirements.txt with missing dependencies",
      "Foundation needed: proper project structure and development tools"
    ],
    "fingerprint": "sha256:analyze_project_structure_etsy_scraper_missing_components"
  }
]
